{
  "name": "Neutral_SMM",
  "notes": "Subjectivity-Minimized Mode. Comparative pass vs baseline; caps by stakes.",
  "purpose_weights": {
    "self": 0.33,
    "right": 0.34,
    "help": 0.33
  },
  "harm_caps": {
    "low": 0.1,
    "med": 0.05,
    "high": 0.01
  },
  "consent_thresholds": {
    "sr_tau": 0.6,
    "consent_tau": 0.8
  },
  "fairness_prior": "individual_fairness",
  "fairness_params": {},
  "reversibility_weight": 0.7,
  "red_lines": [
    "nonconsensual_irreversible",
    "banned_classes"
  ],
  "evidence_gap_cap": 0.05,
  "bias_cap": 1e-09,
  "opacity_cap": 0.01
}